{
  "slug": "khoi-vinh",
  "name": "Khoi Vinh",
  "status": "partial",
  "role": "Designer · writer · subtraction.com",
  "bio": "Khoi Vinh is a designer and long-time design blogger at subtraction.com. Public profiles have associated him with Adobe design work and the Wireframe podcast. Career history includes prominent digital design leadership and continued writing on product and editorial design craft.",
  "links": [
    {
      "label": "Site",
      "url": "https://www.subtraction.com/"
    },
    {
      "label": "X",
      "url": "https://x.com/khoi"
    }
  ],
  "techniqueSlugs": [
    "critique-with-specificity"
  ],
  "highlights": [
    "Long-running subtraction.com design writing.",
    "Public design leadership and Wireframe podcast hosting.",
    "Critique-with-specificity technique."
  ]
}
