{
  "slug": "luke-wroblewski",
  "name": "Luke Wroblewski",
  "status": "partial",
  "role": "Product leader \u00b7 Mobile First \u00b7 lukew.com",
  "bio": "Luke Wroblewski (LukeW) is a digital product leader and author of Mobile First, Web Form Design, and Site-Seeing. Public career includes Google product leadership after Polar\u2019s acquisition, earlier Yahoo and eBay design roles, and ongoing writing at lukew.com. Known for pragmatic mobile and form design craft.",
  "links": [
    {
      "label": "Site",
      "url": "https://www.lukew.com/"
    },
    {
      "label": "X",
      "url": "https://x.com/lukew"
    }
  ],
  "techniqueSlugs": [
    "path-to-completion",
    "evaluate-every-question"
  ],
  "highlights": [
    "Author of Mobile First and Web Form Design.",
    "Public lukew.com essays on product and input craft.",
    "Path-to-completion + evaluate-every-question from public form craft."
  ]
}
