{
  "slug": "craig-mod",
  "name": "Craig Mod",
  "status": "partial",
  "role": "Writer · photographer · publishing craft",
  "bio": "Craig Mod is a writer and photographer based in Japan whose public work explores walking, books, and careful digital publishing. Books include Kissa by Kissa and Things Become Other Things; essays appear on craigmod.com and in outlets such as The New York Times and The Atlantic. Practice emphasizes lightness, attention, and physical/digital book craft.",
  "links": [
    {
      "label": "Site",
      "url": "https://craigmod.com/"
    },
    {
      "label": "About",
      "url": "https://craigmod.com/about/"
    },
    {
      "label": "X",
      "url": "https://x.com/craigmod"
    },
    {
      "label": "Essay · Walk on a Book",
      "url": "https://craigmod.com/essays/to_make_a_book_walk_on_a_book/"
    }
  ],
  "techniqueSlugs": [
    "walk-on-the-artifact",
    "rigor-for-durable-pages"
  ],
  "highlights": [
    "Books and essays on walking Japan and publishing craft.",
    "Special Projects / hand-bound editions as anti-slop making.",
    "Walk-on-the-artifact + durable-page rigor from public essays."
  ]
}
