{
  "slug": "paco-coursey",
  "name": "Paco Coursey",
  "status": "partial",
  "role": "Design engineer \u00b7 Linear \u00b7 interface craft",
  "bio": "Paco Coursey crafts interfaces at Linear (webmaster) and previously developed Vercel\u2019s design system, website, and dashboard. His site paco.me documents polished UI details, projects like a composable command menu (\u2318K), and writing on React hooks and dark mode. Public profile emphasizes typography, motion, and performance as craft.",
  "links": [
    {
      "label": "Site",
      "url": "https://paco.me/"
    },
    {
      "label": "X",
      "url": "https://x.com/pacocoursey"
    },
    {
      "label": "GitHub",
      "url": "https://github.com/pacocoursey"
    }
  ],
  "techniqueSlugs": [
    "own-the-interface-details"
  ],
  "highlights": [
    "Crafting interfaces at Linear; prior Vercel design system work.",
    "Public projects include \u2318K and Writer (plain-text editor).",
    "Own-the-interface-details technique."
  ]
}
